{
      "label": "Mikkel",
      "type": 1,
      "initialState": "initial_state",
      "states": [
        {
      "label": "initial_state",
      "type": "0"
      },{
      "label": "new state",
      "type": "0"
      }
      ],
      "events": [
        
      ],
      "inputs": [
        
      ],
      "outputs": [
        
      ],
      "transitions": [
       
      ],
      "positions": [
        {
      "label": "initial_state",
      "x": 248,
      "y": 188,
      "width": 50
      },{
      "label": "new state",
      "x": 271.203125,
      "y": 347,
      "width": 50
      }
      ]
    }