{
      "label": "A",
      "type": 1,
      "initialState": "new statedsd",
      "states": [
        {
      "label": "A_dsad",
      "type": "0"
      },{
      "label": "Ads",
      "type": "0"
      },{
      "label": "new statedsd",
      "type": "0"
      }
      ],
      "events": [
        "click/msg!"
      ],
      "inputs": [
        "awk"
      ],
      "outputs": [
        "msg"
      ],
      "transitions": [
       {
      "anchorPoint": {
          "x": 159.8984,
          "y": 93.2152
        },
      "from": "Ads",
      "label": "awk",
      "to": "A_dsad"
      },{
      "anchorPoint": {
          "x": 422.84389999999996,
          "y": 257.5719
        },
      "from": "new statedsd",
      "label": "click/msg!",
      "to": "A_dsad"
      }
      ],
      "positions": [
        {
      "label": "A_dsad",
      "x": 131,
      "y": 233,
      "width": 200
      },{
      "label": "Ads",
      "x": 100,
      "y": 40,
      "width": 25
      },{
      "label": "new statedsd",
      "x": 545.7140522875817,
      "y": 105.77777777777777,
      "width": 50
      }
      ]
    }