{
      "label": "B",
      "type": 1,
      "initialState": "B_A",
      "states": [
        {
      "label": "B_A",
      "type": "0"
      },{
      "label": "B_B_B",
      "type": "0"
      }
      ],
      "events": [
        "click","pointerenter/output!"
      ],
      "inputs": [
        
      ],
      "outputs": [
        "output"
      ],
      "transitions": [
       {
      "anchorPoint": {
          "x": 477.0264,
          "y": 398.30080000000004
        },
      "from": "B_A",
      "label": "click",
      "to": "B_B_B"
      },{
      "anchorPoint": {
          "x": 589.9736,
          "y": 354.1992
        },
      "from": "B_B_B",
      "label": "pointerenter/output!",
      "to": "B_A"
      }
      ],
      "positions": [
        {
      "label": "B_A",
      "x": 420,
      "y": 309,
      "width": 24
      },{
      "label": "B_B_B",
      "x": 580,
      "y": 435,
      "width": 83
      }
      ]
    }