{
      "label": "onOffComponent",
      "type": 1,
      "initialState": "off",
      "states": [
        {
      "label": "off",
      "type": "0"
      },{
      "label": "on",
      "type": "0"
      }
      ],
      "events": [
        "click"
      ],
      "inputs": [
        "onsettoon"
      ],
      "outputs": [
        
      ],
      "transitions": [
       {
      "anchorPoint": {
          "x": 280.01335000000006,
          "y": 242.49737500000003
        },
      "from": "off",
      "label": "click",
      "to": "on"
      },{
      "anchorPoint": {
          "x": 327.18977499999994,
          "y": 415.5026250000001
        },
      "from": "on",
      "label": "click",
      "to": "off"
      },{
      "anchorPoint": {
          "x": 307.01335000000006,
          "y": 312.49737500000003
        },
      "from": "off",
      "label": "onsettoon",
      "to": "on"
      }
      ],
      "positions": [
        {
      "label": "off",
      "x": 115,
      "y": 345,
      "width": 50
      },{
      "label": "on",
      "x": 402.203125,
      "y": 246,
      "width": 50
      }
      ]
    }