{
      "label": "Toggle",
      "type": 1,
      "initialState": "off",
      "states": [
        {
      "label": "off",
      "type": "0"
      },{
      "label": "on",
      "type": "0"
      }
      ],
      "events": [
        "click"
      ],
      "inputs": [
        
      ],
      "outputs": [
        
      ],
      "transitions": [
       {
      "anchorPoint": {
          "x": 227.88639999999998,
          "y": 366.8672000000001
        },
      "from": "off",
      "label": "click",
      "to": "on"
      },{
      "anchorPoint": {
          "x": 363.1136,
          "y": 278.13280000000003
        },
      "from": "on",
      "label": "click",
      "to": "off"
      }
      ],
      "positions": [
        {
      "label": "off",
      "x": 147,
      "y": 194,
      "width": 50
      },{
      "label": "on",
      "x": 390,
      "y": 383,
      "width": 50
      }
      ]
    }